{
  "algorithm_version": "1.1.0",
  "changes": [
    {
      "kind": "unknown_baseline",
      "path": "README.md",
      "repository": "common-workflow-language/cwl-v1.2",
      "source_id": "cwl-standard"
    },
    {
      "kind": "unknown_baseline",
      "path": "README.md",
      "repository": "crs4/life_monitor",
      "source_id": "lifemonitor"
    },
    {
      "kind": "unknown_baseline",
      "path": "docs/wfhub-setup-notes.md",
      "repository": "crs4/life_monitor",
      "source_id": "lifemonitor"
    },
    {
      "kind": "unknown_baseline",
      "path": "README.md",
      "repository": "seek4science/seek",
      "source_id": "seek"
    },
    {
      "kind": "unknown_baseline",
      "path": "README.md",
      "repository": "workflowhub-eu/about",
      "source_id": "workflowhub"
    },
    {
      "kind": "unknown_baseline",
      "path": "Workflow-RO-Crate/1.1/changelog.md",
      "repository": "workflowhub-eu/about",
      "source_id": "workflowhub"
    },
    {
      "kind": "unknown_baseline",
      "path": "Workflow-RO-Crate/1.1/index.md",
      "repository": "workflowhub-eu/about",
      "source_id": "workflowhub"
    },
    {
      "kind": "unknown_baseline",
      "path": "developer/how-to-make-a-workflow-ro-crate.md",
      "repository": "workflowhub-eu/about",
      "source_id": "workflowhub"
    },
    {
      "kind": "unknown_baseline",
      "path": "docs/maintaining-your-workflow.md",
      "repository": "workflowhub-eu/about",
      "source_id": "workflowhub"
    },
    {
      "kind": "unknown_baseline",
      "path": "docs/registering_workflows/adding-files.md",
      "repository": "workflowhub-eu/about",
      "source_id": "workflowhub"
    },
    {
      "kind": "unknown_baseline",
      "path": "docs/registering_workflows/check-uploaded-workflow.md",
      "repository": "workflowhub-eu/about",
      "source_id": "workflowhub"
    },
    {
      "kind": "unknown_baseline",
      "path": "docs/registering_workflows/complete-workflow-metadata.md",
      "repository": "workflowhub-eu/about",
      "source_id": "workflowhub"
    },
    {
      "kind": "unknown_baseline",
      "path": "docs/registering_workflows/register-and-login.md",
      "repository": "workflowhub-eu/about",
      "source_id": "workflowhub"
    },
    {
      "kind": "unknown_baseline",
      "path": "docs/registering_workflows/registering-a-workflow.md",
      "repository": "workflowhub-eu/about",
      "source_id": "workflowhub"
    },
    {
      "kind": "unknown_baseline",
      "path": "docs/registering_workflows/supported-workflow-types.md",
      "repository": "workflowhub-eu/about",
      "source_id": "workflowhub"
    }
  ],
  "diagnostics": [],
  "input_digest": "0fc7d508fa5afb89eb9eec424869ae107ab28ff2419f124cafe8f88e6f483005",
  "output_digest": "5c3ee4aaea441494d94155ee06b3263d401a8a21dcbf7af738d2d778d63d5d67",
  "profile_digest": "787471b78dfe37c2e63d0bbc637a747b53150590210b4bfab61d3b74aea835a3",
  "projection_eligible": true,
  "records": [
    {
      "blob_sha": "a15301297cdf5472800c2cc1c136d45bd620fcbb",
      "collector_version": "0.3.0",
      "commit": "979083396fee912fca8ef778174216d317338a00",
      "content_sha256": "5dee437bac676a000ed5bd0e654808a3e16af0d7ff6cac7982abd871e41b3c4c",
      "path": "README.md",
      "raw_size": 343,
      "ref": "main",
      "repository": "common-workflow-language/cwl-v1.2",
      "selection_rule": "cwl-standard@1.0.0",
      "source_id": "cwl-standard",
      "source_registry": "life-science-approved-github-sources",
      "text": "Hello!\n\nThis repo holds the ratified v1.2.1 of the Common Workflow Language standards and the history of its development.\n\nYou can render this using https://github.com/common-workflow-language/cwl-website/blob/main/website.sh\n\nYou may browse the CWL v1.2.1 standards online at https://w3id.org/cwl/v1.2/ (a.k.a https://www.commonwl.org/v1.2 )\n",
      "tree_sha": "87409dd7d56367bd19c950338f577d38f424b507",
      "trust": "primary"
    },
    {
      "blob_sha": "19e65eb271f944a9ab45e3581fa11cea29894468",
      "collector_version": "0.3.0",
      "commit": "7649406c11c5c04eebc5ca61926f5dbe30469c82",
      "content_sha256": "4449a4880e577aca474c11a615e66c8afc6bcd2daa8eaf7f2893f7cea99321ff",
      "path": "README.md",
      "raw_size": 2356,
      "ref": "master",
      "repository": "crs4/life_monitor",
      "selection_rule": "lifemonitor@1.0.0",
      "source_id": "lifemonitor",
      "source_registry": "life-science-approved-github-sources",
      "text": "[![main workflow](https://github.com/crs4/life_monitor/actions/workflows/main.yaml/badge.svg)](https://github.com/crs4/life_monitor/actions/workflows/main.yaml)\n[![docs workflow](https://github.com/crs4/life_monitor/actions/workflows/docs.yaml/badge.svg)](https://github.com/crs4/life_monitor/actions/workflows/docs.yaml)\n\n\n<div align=\"center\" style=\"text-align: center; margin-top: 50px;\">\n<img src=\"/docs/life_monitor_logo.png\" alt=\"Life-Monitor logo\"\n     width=\"300px\" style=\"margin-top: 50px;\" align=\"center\" />\n</div>\n\n<br/>\n<br/>\n\nLifeMonitor is a testing and monitoring service for computational\nworkflows. Head over to the [LifeMonitor web\nsite](https://crs4.github.io/life_monitor) for more information and instructions.\n\n\n## Getting Started\n\nYou can easily set up your own ready-to-use LifeMonitor instance using the\ndocker-compose deployment we distribute with this repository. A `Makefile`\nprovides you with the basic actions necessary to manage the deployment.\nType `make help` to list the available options.\n\nYou can get a development / testing deployment of LifeMonitor with the\nfollowing commands:\n\n0. `docker network create life_monitor`, to create the Docker network;\n1. `make start`, to start the main LifeMonitor services;\n2. `make start-aux-services`, to start the preconfigured instances of WorkflowHub and Jenkins.\n\nTo register the WorkflowHub instance with LifeMonitor, run:\n\n```\ndocker-compose exec lm /bin/bash -c \"flask registry add seek seek ehukdECYQNmXxgJslBqNaJ2J4lPtoX_GADmLNztE8MI DuKar5qYdteOrB-eTN4F5qYSp-YrgvAJbz1yMyoVGrk https://seek:3000 --redirect-uris https://seek:3000\"\n```\n\nYou should now have the following services up and running:\n\n* **LifeMonitor** @ https://localhost:8443\n* **WorkflowHub** @ https://seek:3000\n* **Jenkins** @ http://localhost:8080\n\nFor additional information, please refer to the [LifeMonitor administration\nguide](https://crs4.github.io/life_monitor/lm_admin_guide).\n\n\n<br><br><br>\n<div align=\"center\" style=\"text-align: center;\">\n  <div><b style=\"font-size: larger\">Acknowledgements</b></div>\n  <div>\n    Life Monitor is being developed as part of the <a href=\"https://www.eosc-life.eu/\">EOSC-Life project</a>.\n  </div>\n  <img alt=\"EOSC-Life, CRS4, BBMRI-ERIC Logos\"\n       src=\"https://github.com/crs4/life_monitor/raw/master/docs/footer-logo.svg\"\n\t   width=\"350\" align=\"center\"/>\n</div>\n",
      "tree_sha": "8bf8d130ff763b67aec86b7ef1271f700444ff14",
      "trust": "primary"
    },
    {
      "blob_sha": "ffb760643ac7c96ee79e8bd42511e75e728ac0b8",
      "collector_version": "0.3.0",
      "commit": "7649406c11c5c04eebc5ca61926f5dbe30469c82",
      "content_sha256": "3a65eaaef45a4b4e7cbe41483f34c0600b0df55278c293d624ebb6f480acdd0e",
      "path": "docs/wfhub-setup-notes.md",
      "raw_size": 2156,
      "ref": "master",
      "repository": "crs4/life_monitor",
      "selection_rule": "lifemonitor@1.0.0",
      "source_id": "lifemonitor",
      "source_registry": "life-science-approved-github-sources",
      "text": "\n# Bringing up WorkflowHub with HTTPS configuration\n\nIn this example we're going to use the same self-signed certificates generated\nby our Makefile, which we're going to mount on `/nginx/certs` on the\nWorkflowHub Docker container.\n\nApply the following modifications to the WorkflowHub `nginx.conf` file:\n\n\n```diff\n@@ -63,7 +63,10 @@ http {\n         # gzip_http_version 1.1;\n \n         server {\n-               listen 3000;\n+               listen 3000 ssl default_server;\n+               ssl_certificate /nginx/certs/lm.crt;\n+               ssl_certificate_key /nginx/certs/lm.key;\n                root /seek/public;\n                client_max_body_size 2G;\n                location / {\n@@ -72,6 +75,7 @@ http {\n                     proxy_set_header   X-Real-IP $remote_addr;\n                     proxy_set_header   X-Forwarded-For $proxy_add_x_forwarded_for;\n                     proxy_set_header   X-Forwarded-Host $server_name;\n+                    proxy_set_header   X-Forwarded-Proto $scheme;\n                }\n                 location ^~ /(assets)/  {\n                                gzip_static on;\n```\n\nYou can change `docker/nginx.conf` on the WorkflowHub git repo (currently on\nthe \"workflow\" branch of https://github.com/seek4science/seek) and rebuild the\nimage locally, or overwrite the `/etc/nginx` dir on the WorkflowHub container\nwith a bind mount. For instance, suppose you have copied the contents of\n`/etc/nginx` from the WorkflowHub container to `/tmp/etc_nginx`. Also suppose\nour certificates are on `/tmp/certs`. Finally, we're going to map `lm.org` (the\nhostname in the self-signed certificates) to the physical host's (internal) IP\naddress (you can get it with `ifconfig` on Linux): suppose this is\n`192.168.1.167`. We're going to run WorkflowHub on a single Docker container,\nand put it on a network called `seek_default`.\n\n```\ndocker network create seek_default\ndocker run -d --network seek_default -p 3000:3000 \\\n  -v /tmp/etc_nginx:/etc/nginx:ro -v /tmp/certs:/nginx/certs:ro \\\n  --add-host lm.org:192.168.1.167 --name wfhub fairdom/seek:workflow\n```\n\nAlso add a `192.168.1.167 lm.org` entry to the physical host's `/etc/hosts`.\n",
      "tree_sha": "8bf8d130ff763b67aec86b7ef1271f700444ff14",
      "trust": "primary"
    },
    {